{
  "$schema": "https://json-schema.org/draft/2020-12/schema",
  "$id": "https://ogsystem.dev/schemas/runtime-config.schema.json",
  "title": "OGSystem Runtime Config",
  "type": "object",
  "additionalProperties": false,
  "required": ["executor", "roleRepo"],
  "properties": {
    "configVersion": {
      "type": "string",
      "enum": ["1", "2"]
    },
    "executor": {
      "type": "string",
      "enum": ["opencode"]
    },
    "roleRepo": {
      "type": "string",
      "minLength": 1
    },
    "runsDir": {
      "type": "string",
      "minLength": 1
    },
    "sharedDir": {
      "type": "string",
      "minLength": 1
    },
    "workspace": {
      "type": "object",
      "additionalProperties": false,
      "properties": {
        "rolesDir": {
          "type": "string",
          "minLength": 1
        },
        "privateDirName": {
          "type": "string",
          "minLength": 1
        },
        "workspaceIsolation": {
          "type": "string",
          "enum": ["role", "branch"]
        }
      }
    },
    "retention": {
      "type": "object",
      "additionalProperties": false,
      "properties": {
        "enabled": {
          "type": "boolean"
        },
        "executionDirThreshold": {
          "type": "integer",
          "minimum": 1
        },
        "keepLatest": {
          "type": "integer",
          "minimum": 1
        }
      }
    },
    "runtime": {
      "type": "object",
      "additionalProperties": false,
      "properties": {
        "error_flows": {
          "type": "object",
          "additionalProperties": false,
          "properties": {
            "v1": {
              "type": "boolean"
            }
          }
        }
      }
    },
    "redaction": {
      "type": "object",
      "additionalProperties": false,
      "properties": {
        "enabled": {
          "type": "boolean"
        }
      }
    },
    "tools": {
      "type": "object",
      "additionalProperties": false,
      "properties": {
        "environmentPolicy": {
          "type": "string",
          "enum": ["inherit", "minimal"]
        },
        "envAllowlist": {
          "type": "array",
          "uniqueItems": true,
          "items": {
            "type": "string",
            "pattern": "^[A-Za-z_][A-Za-z0-9_]*$"
          }
        }
      }
    },
    "opencode": {
      "type": "object",
      "additionalProperties": false,
      "properties": {
        "baseArgs": {
          "type": "array",
          "items": {
            "type": "string",
            "minLength": 1
          }
        }
      }
    }
  }
}
